<?xml version="1.0" encoding="UTF-8" standalone="yes" ?>
<manifest
	xmlns="urn:oid:1.3.6.1.4.1.37476.2.5.2.5.2" 
	xmlns:xsi="http://www.w3.org/2001/XMLSchema-instance"
	xsi:schemaLocation="urn:oid:1.3.6.1.4.1.37476.2.5.2.5.2 https://oidplus.viathinksoft.com/oidplus/plugins/manifest_plugin.xsd">

	<type>OIDplusPagePluginPublic</type>

	<info>
		<name>Resources</name>
		<author>ViaThinkSoft</author>
		<version />
		<descriptionHTML />
		<oid>1.3.6.1.4.1.37476.2.5.2.4.1.500</oid>
	</info>

	<php>
		<mainclass>OIDplusPagePublicResources</mainclass>
	</php>

	<css>
	</css>

	<js>
	</js>
	
</manifest>
