<?xml version="1.0" encoding="UTF-8" standalone="yes" ?>
<manifest
	xmlns="urn:oid:1.3.6.1.4.1.37476.2.5.2.5.2" 
	xmlns:xsi="http://www.w3.org/2001/XMLSchema-instance"
	xsi:schemaLocation="urn:oid:1.3.6.1.4.1.37476.2.5.2.5.2 https://oidplus.viathinksoft.com/oidplus/plugins/manifest_plugin.xsd">

	<type>OIDplusObjectTypePlugin</type>

	<info>
		<name>Digital Object Identifier (DOI)</name>
		<author>ViaThinkSoft</author>
		<version />
		<descriptionHTML />
		<oid>1.3.6.1.4.1.37476.2.5.2.4.8.1</oid>
	</info>

	<php>
		<mainclass>OIDplusObjectTypePluginDoi</mainclass>
	</php>
	
</manifest>
